id,phase,cycle_day_min,cycle_day_max,kind,tag,icon,title,body
591,ovulation,14,16,care,Care,heart,Natural fragrance suits you now,Your natural scent changes at ovulation and becomes more attractive to others. Heavy perfume is genuinely unnecessary today.
592,ovulation,14,16,care,Care,heart,Contraception reminder,Ovulation is when you are most fertile. Ensure your contraceptive method is being used correctly if pregnancy is not desired.
593,ovulation,14,16,care,Care,heart,Post-peak energy management,The ovulation energy peak is short. Plan to ease back from your most intense activities after day 16 as progesterone begins to rise.
594,ovulation,14,16,care,Care,heart,Check your posture under load,Joint laxity at ovulation makes posture under load more important. Core engagement and joint alignment need conscious attention.
595,ovulation,14,16,care,Care,heart,Light evening nutrition,After peak performance at ovulation a lighter evening meal that is still protein-rich supports recovery and the hormonal transition ahead.
596,ovulation,14,16,care,Care,heart,Warm bath for transition,As ovulation completes a warm bath with Epsom salts supports the body through the hormonal transition into the luteal phase.
597,ovulation,14,16,care,Care,heart,Schedule luteal support in advance,Book massage plan recovery activities and reduce your calendar commitments starting day 17. Future you will be grateful.
598,ovulation,14,16,care,Care,heart,Vitamin B6 for corpus luteum,The corpus luteum that forms after ovulation needs B6. Ensuring adequate intake now supports the progesterone production to come.
599,ovulation,14,16,care,Care,heart,Progesterone cream consideration,Some people use natural progesterone cream post-ovulation to support the luteal phase. Discuss with a healthcare provider.
600,luteal,17,28,food,Nourish,leaf,Seed cycling with sesame and sunflower,The luteal phase seed cycling protocol uses sesame and sunflower seeds to support progesterone production.
601,luteal,17,28,food,Nourish,leaf,Turkey for tryptophan,Turkey is rich in tryptophan which converts to serotonin and then melatonin supporting both mood and sleep in the luteal phase.
602,luteal,17,28,food,Nourish,leaf,Complex carbohydrate timing,Eating complex carbohydrates in the afternoon blunts the late-day cortisol spike that worsens PMS anxiety.
603,luteal,17,28,food,Nourish,leaf,Evening primrose oil luteal,Taking evening primrose oil in the luteal phase reduces breast tenderness mood symptoms and bloating for many people.
604,luteal,17,28,food,Nourish,leaf,Chickpea and vegetable curry,A warming chickpea curry provides progesterone-supporting zinc and B6 plus the slow carbohydrates that stabilise luteal blood sugar.
605,luteal,17,28,food,Nourish,leaf,Reduce caffeine by half,Caffeine increases cortisol and worsens anxiety breast tenderness and insomnia in the luteal phase. Halve your usual intake.
606,luteal,17,28,food,Nourish,leaf,Liver-supportive foods always,Milk thistle tea dandelion and bitter greens support the liver in processing the progesterone rise and clearing metabolic waste.
607,luteal,17,28,food,Nourish,leaf,Oats for sustained energy,Porridge made with oats and almond milk provides slow-release carbohydrates that prevent the mid-morning energy crash of the luteal phase.
608,luteal,17,28,food,Nourish,leaf,Sunflower seed butter,A rich source of vitamin E and selenium sunflower seed butter on rice cakes is a satisfying luteal snack that supports progesterone.
609,luteal,17,28,food,Nourish,leaf,Cottage cheese before bed,Cottage cheese provides slow-digesting casein protein that sustains amino acid supply through the night supporting sleep and recovery.
610,luteal,17,28,food,Nourish,leaf,Reduce oxalate foods if crampy,High-oxalate foods like spinach almonds and chocolate can worsen cramping in the late luteal phase for some people.
611,luteal,17,28,food,Nourish,leaf,Peppermint oil for IBS symptoms,The bowel changes of the luteal phase can mimic IBS. Enteric-coated peppermint oil reduces gut cramping and bloating effectively.
612,luteal,17,28,food,Nourish,leaf,Serotonin-boosting breakfast,Eggs avocado and whole grain toast provides tryptophan healthy fats and complex carbs — the combination that best supports serotonin.
613,luteal,17,28,food,Nourish,leaf,Avoid salty restaurant food,Restaurant food typically contains far more sodium than home cooking. Excess salt in the luteal phase significantly worsens bloating.
614,luteal,17,28,food,Nourish,leaf,Water with lemon and ginger,This combination supports liver function reduces bloating and provides anti-inflammatory benefits throughout the luteal phase.
615,luteal,17,28,food,Nourish,leaf,Adequate calorie intake,Many people under-eat in the luteal phase due to reduced appetite. Insufficient calories worsen PMS fatigue and mood symptoms.
616,luteal,17,28,food,Nourish,leaf,Cooked over raw vegetables,Cooking vegetables makes them easier to digest and reduces the bloating that raw foods can cause in the progesterone-dominant phase.
617,luteal,17,28,food,Nourish,leaf,Snack preparation in advance,Prepare a week of snacks on day 17. When cravings hit in day 24 having healthy options ready prevents poor choices.
618,luteal,17,28,food,Nourish,leaf,Vitamin B12 for energy,B12 supports the mitochondrial energy production that declines in the luteal phase. Eggs meat or fortified foods each day.
619,luteal,17,28,food,Nourish,leaf,Protein at every snack,Even snacks should contain protein in the luteal phase. Cheese rice cakes nuts or yogurt prevent blood sugar crashes.
620,luteal,17,28,food,Nourish,leaf,Ginger in everything,Fresh or ground ginger reduces nausea reduces prostaglandins and adds anti-inflammatory benefit to every meal in the luteal phase.
621,luteal,17,28,food,Nourish,leaf,Reduce nightshades if inflamed,Tomatoes peppers and aubergine contain solanine which can increase inflammation in sensitive individuals during the luteal phase.
622,luteal,17,28,food,Nourish,leaf,Prebiotic foods for gut health,Garlic onion leeks and asparagus feed beneficial gut bacteria that influence the gut-brain serotonin axis during the luteal phase.
623,luteal,17,28,food,Nourish,leaf,Coconut oil cooking fat,Coconut oil provides medium-chain triglycerides that are rapidly available as energy without spiking blood sugar in the luteal phase.
624,luteal,17,28,food,Nourish,leaf,Zinc for progesterone support,Zinc is required for progesterone production. Pumpkin seeds oysters and chickpeas replenish the zinc needed for the luteal phase.
625,luteal,17,28,food,Nourish,leaf,Slow-cooked meals,Slow-cooked stews soups and casseroles are warming nourishing and easy to digest exactly what the luteal body needs.
626,luteal,17,28,food,Nourish,leaf,Limit gluten if bloating persists,Some people find gluten significantly worsens luteal bloating and digestive symptoms. A trial elimination can clarify this.
627,luteal,17,28,food,Nourish,leaf,Nettle and oat straw infusion,A long-steeped infusion of nettle and oat straw provides abundant minerals that reduce PMS symptoms when taken daily.
628,luteal,17,28,food,Nourish,leaf,Bitter herbs before meals,Bitters like artichoke dandelion or gentian taken before meals stimulate digestive enzymes and reduce the bloating of the luteal phase.
629,luteal,17,28,food,Nourish,leaf,Melatonin-supporting foods,Tart cherries walnuts and kiwis naturally contain or support melatonin production for the disrupted sleep of the luteal phase.
630,luteal,17,28,food,Nourish,leaf,Avoid eating late,Progesterone slows digestion significantly. Eating after 8pm increases bloating and disrupts the already fragile luteal sleep.
631,luteal,17,28,food,Nourish,leaf,Herbal adaptogens,Ashwagandha and rhodiola help the body adapt to the cortisol fluctuations of the luteal phase. Take in the morning.
632,luteal,17,28,food,Nourish,leaf,Colourful anti-PMS smoothie,Blend banana spinach pumpkin seeds almond milk and a pinch of cinnamon for a PMS-targeting breakfast smoothie.
633,luteal,17,28,food,Nourish,leaf,Phosphatidylserine for cortisol,This supplement reduces the elevated cortisol of the late luteal phase which worsens anxiety brain fog and sleep disruption.
634,luteal,17,21,move,Move,heart,Moderate intensity maintained,Early luteal energy is still reasonable. Maintain training but reduce volume by 20 percent and prioritise form over intensity.
635,luteal,17,28,move,Move,heart,Slow flow yoga,A slow vinyasa or gentle flow class bridges the gap between active training and the restorative movement the luteal body needs.
636,luteal,17,28,move,Move,heart,Nature bathing walk,Walking slowly through natural spaces reduces cortisol by measurable amounts and provides the low-intensity movement perfect for this phase.
637,luteal,17,28,move,Move,heart,MELT method or self-myofascial release,The MELT method uses small balls and rollers to release connective tissue tension that builds in the luteal phase.
638,luteal,17,28,move,Move,heart,Feldenkrais method,Gentle awareness-through-movement sequences from the Feldenkrais method are ideally matched to luteal nervous system sensitivity.
639,luteal,17,28,move,Move,heart,Slow morning sun salutations,5-10 slow sun salutations in the morning warm the body gently and connect breath to movement without demanding high output.
640,luteal,17,28,move,Move,heart,Seated meditation movement,Combining seated meditation with gentle seated stretches provides movement benefit with minimum energy expenditure.
641,luteal,17,28,move,Move,heart,Slow cycling commute,If you cycle to work slow your pace significantly in the luteal phase. Arriving slightly slower is far better than arriving depleted.
642,luteal,22,28,move,Move,heart,Chair yoga,If energy is very low chair yoga provides gentle movement and breath awareness without getting on the floor.
643,luteal,17,28,move,Move,heart,Qigong for late cycle,Qigong is specifically designed for internal energy cultivation. The slow meditative movements are perfect for the inward luteal phase.
644,luteal,17,28,move,Move,heart,Tai chi morning practice,The slow meditative flow of tai chi suits luteal energy perfectly providing movement meditation and stress relief simultaneously.
645,luteal,17,28,move,Move,heart,Gentle dance to your playlist,Put on a playlist and move however feels good. No choreography no structure just gentle spontaneous movement.
646,luteal,17,28,move,Move,heart,Short yoga nidra,A 20-minute yoga nidra is more restorative than a 20-minute sleep and is the highest return on investment movement for the luteal phase.
647,luteal,17,28,move,Move,heart,Avoid HIIT in late luteal,High intensity work in the late luteal phase elevates cortisol to levels that worsen PMS anxiety and disrupt sleep significantly.
648,luteal,17,28,move,Move,heart,Step count over intensity,Aim for 7000 steps spread throughout the day rather than concentrated exercise. Distributed movement is gentler on luteal hormones.
649,luteal,17,28,move,Move,heart,Pool noodle float,Floating in a pool with a noodle requires minimal effort and provides full decompression for the fluid-heavy luteal body.
650,luteal,22,28,move,Move,heart,Legs up the wall 10 minutes,This restorative inversion reduces lower limb fluid retention reduces cortisol and is deeply calming before sleep.
651,luteal,17,28,move,Move,heart,Gentle hip flow sequence,A 15-minute sequence of hip circles pigeon pose and supine twists addresses the muscle tension that builds in the luteal phase.
652,luteal,17,28,move,Move,heart,Avoid alcohol post-exercise,Alcohol after exercise is always counterproductive but in the luteal phase it specifically disrupts the progesterone-dependent recovery process.
653,luteal,17,28,move,Move,heart,Walking meditation,A slow intentional walk where you focus entirely on sensation is simultaneously movement meditation and cortisol reduction.
654,luteal,17,28,move,Move,heart,Gentle back care sequence,The lower back tension of the luteal phase responds well to cat-cow sphinx pose and supported bridge held gently.
655,luteal,17,28,move,Move,heart,Savasana as practice,Lying in savasana with intention for 10-15 minutes is a legitimate restorative practice not laziness during the luteal phase.
656,luteal,17,28,move,Move,heart,Evening wind-down movement,15 minutes of gentle stretching an hour before bed reduces overnight muscle tension and measurably improves luteal sleep quality.
657,luteal,17,28,move,Move,heart,Slow strength maintenance,If you enjoy strength training keep going but reduce weight by 20-30 percent and rest longer between sets in the late luteal phase.
658,luteal,17,28,move,Move,heart,Cold water therapy brief,30 seconds of cold water at the end of a shower reduces inflammation and provides a brief energy boost safe for the luteal phase.
659,luteal,17,28,mood,Mind,moon,Energy audit your calendar,Look at the next two weeks and identify where you are overcommitted. Remove or reschedule one thing that is not essential.
660,luteal,17,28,mood,Mind,moon,Review the cycle journal,Read what you wrote in earlier phases this cycle. Noticing the contrast helps you build a complete picture of your pattern.
661,luteal,17,28,mood,Mind,moon,Appreciate what the luteal offers,This phase offers depth perception honesty and the ability to sense what is not working. These are valuable gifts not just burdens.
662,luteal,17,28,mood,Mind,moon,Prepare the menstrual nest,Get your comfort items ready - heat pad favourite tea comfy clothes and a good show. Having them organised reduces day-1 stress.
663,luteal,22,28,mood,Mind,moon,One task per hour maximum,When energy and focus are fragmenting stop trying to multitask. One single task with full attention is more effective anyway.
664,luteal,17,28,mood,Mind,moon,Honest relationship check,The perceptiveness of the luteal phase often surfaces things that are not working in relationships. Note them without acting on them.
665,luteal,17,28,mood,Mind,moon,Somatic shaking practice,Allowing the body to shake gently and spontaneously for 5-10 minutes releases stored tension from the nervous system.
666,luteal,17,28,mood,Mind,moon,Reduce information inputs,Social media news podcasts and constant notifications all require cognitive processing that depletes the limited luteal mental bandwidth.
667,luteal,17,28,mood,Mind,moon,Compassionate self-talk script,Write down 3-5 compassionate phrases to use when the inner critic is loud in the luteal phase. Read them morning and evening.
668,luteal,22,28,mood,Mind,moon,Avoid self-critical decisions,Decisions about your appearance career relationships or worth feel more negative in late luteal. Postpone all such evaluations.
669,luteal,17,28,mood,Mind,moon,The power of mundane tasks,Ironing folding or gentle cleaning requires just enough focus to quiet an anxious mind without demanding real cognitive effort.
670,luteal,17,28,mood,Mind,moon,Honour the no,Saying no without explanation is a complete sentence. The luteal phase is when the cost of over-commitment is highest.
671,luteal,17,28,mood,Mind,moon,Revisit your values,What matters most to you right now. Luteal perception cuts through noise and surface concerns to what is genuinely important.
672,luteal,17,28,mood,Mind,moon,Music for mood regulation,Create a playlist for the luteal phase that matches your energy at first then gradually elevates it. Music is a genuine mood tool.
673,luteal,22,28,mood,Mind,moon,Slow down speed of speech,When anxiety is high we often speak too fast which increases physiological arousal. Consciously slowing your speech reduces anxiety.
674,luteal,17,28,mood,Mind,moon,Evening phone-free time,One hour before bed completely phone-free reduces the cortisol and comparison that significantly disrupt luteal sleep and mood.
675,luteal,17,28,mood,Mind,moon,Write your completion list,List everything you have completed this cycle. The luteal brain underestimates achievement. Writing it makes it visible.
676,luteal,17,28,mood,Mind,moon,Comfort without shame,Wanting comfort food familiar places and people you love in the luteal phase is healthy and hormonally appropriate. Give yourself these things.
677,luteal,22,28,mood,Mind,moon,Morning journaling 3 pages,Writing 3 long-hand pages first thing externalises the internal processing that happens overnight and reduces morning anxiety.
678,luteal,17,28,mood,Mind,moon,One pleasure planned daily,Each morning plan one small pleasure for later in the day. Having something to look forward to reduces luteal dread.
679,luteal,17,28,mood,Mind,moon,Long exhale breathing,Making your exhale twice as long as your inhale directly activates the vagus nerve and reduces the anxiety of the luteal phase.
680,luteal,17,28,mood,Mind,moon,Acknowledge the transition,You are moving toward the end of the cycle. This is a transition not a failure. Rest integration and release are productive.
681,luteal,17,28,mood,Mind,moon,Reduce your definition of success,A luteal success looks different from a follicular one. Redefine what a good day means this week rather than measuring against a different phase.
682,luteal,22,28,mood,Mind,moon,Write what this cycle taught you,Every cycle teaches you something. Writing it before menstruation begins creates the insight that feeds your next cycle intentions.
683,luteal,17,28,mood,Mind,moon,Practice radical acceptance,Whatever is happening right now is happening. Resistance increases suffering. Acceptance does not mean approval - it means releasing the fight.
684,luteal,17,28,care,Care,drop,Naturopathic liver support,Milk thistle supplement supports liver clearance of estrogen and progesterone metabolites that contribute to PMS if they accumulate.
685,luteal,17,28,care,Care,drop,Tongue diagnosis,A coated tongue often appears in the luteal phase indicating digestive sluggishness. Tongue scraping and bitter herbs address this.
686,luteal,22,28,care,Care,drop,Pack your period bag now,Having period supplies in your bag from day 22 onwards removes the stress of being caught unprepared when day 1 arrives.
687,luteal,17,28,care,Care,drop,Progesterone-supporting sleep position,Sleeping on your left side supports lymphatic drainage and is generally more comfortable when bloated in the luteal phase.
688,luteal,17,28,care,Care,drop,Track breast changes,Note whether breast tenderness starts on the same day each cycle. Consistent patterns are normal. Changes to the pattern warrant attention.
689,luteal,17,28,care,Care,drop,Screen time blue light block,Installing a blue light filter on all screens and using it from 7pm reduces the luteal sleep disruption caused by melatonin suppression.
690,luteal,17,28,care,Care,drop,Skin sensitivity products,Switch to fragrance-free gentle products in the luteal phase. Skin sensitivity increases with progesterone and reactions are more likely.
691,luteal,17,28,care,Care,drop,Clay mask for congested skin,Progesterone-related skin congestion responds well to a weekly clay mask. Kaolin or bentonite clay is gentle and effective.
692,luteal,17,28,care,Care,drop,Compression socks for travel,Luteal fluid retention makes legs swell more on long journeys. Compression socks prevent discomfort and reduce post-travel swelling.
693,luteal,17,28,care,Care,drop,Dry brushing for fluid retention,5 minutes of dry brushing toward the heart before showering moves lymphatic fluid and reduces the puffiness of luteal water retention.
694,luteal,17,28,care,Care,drop,Scalp oil treatment,Progesterone can make the scalp oilier. An overnight oil treatment with jojoba or rosemary oil balances the scalp environment.
695,luteal,17,28,care,Care,drop,Cold water eye mask,Chilled eye masks or cold cucumber slices reduce the puffiness that can appear under eyes in the luteal phase due to fluid retention.
696,luteal,22,28,care,Care,drop,Perineal massage,Regular perineal massage in the late luteal phase releases the pelvic floor tension that accompanies premenstrual cramping.
697,luteal,17,28,care,Care,drop,Reduce screen brightness,Reducing screen brightness in the afternoon reduces the overstimulation that contributes to luteal phase headaches and eye strain.
698,luteal,17,28,care,Care,drop,Humidifier for skin and sleep,Progesterone reduces skin hydration. A bedroom humidifier prevents the dryness that contributes to luteal skin sensitivity and poor sleep.
699,luteal,17,28,care,Care,drop,B6 cream for PMS,Topical B6 applied to the wrist has shown benefit for PMS mood and breast tenderness in some small studies.
700,luteal,17,28,care,Care,drop,Aromatherapy for PMS,Clary sage geranium and ylang ylang essential oils have specific hormonal balancing properties useful in the luteal phase.
701,luteal,22,28,care,Care,drop,Herbal PMS tea blend,A blend of raspberry leaf chaste berry vitex and skullcap brewed as an evening tea significantly reduces PMS symptoms over time.
702,luteal,17,28,care,Care,drop,Bowel habit awareness,Progesterone slows peristalsis and many people become constipated in the luteal phase. Extra water magnesium and movement address this.
703,luteal,17,28,care,Care,drop,Anti-inflammatory skincare,Products containing niacinamide centella and azelaic acid reduce the inflammation-related skin issues of the luteal phase.
704,luteal,17,28,care,Care,drop,Chaste tree berry supplement,Vitex agnus-castus taken daily for several cycles significantly reduces PMS symptoms by supporting progesterone. Requires consistent use.
705,luteal,17,28,care,Care,drop,Gentle peeling exfoliant,A gentle lactic acid exfoliant used once in the luteal phase addresses congestion without irritating the more sensitive luteal skin.
706,luteal,17,28,care,Care,drop,Pre-period supplement stack,Starting iron magnesium B complex and omega-3 on day 17 and continuing through menstruation prevents the worst of period symptoms.
707,luteal,22,28,care,Care,drop,Note what brings relief,Pay attention to exactly what reduces your symptoms this week. Building a personalised PMS relief toolkit is worth the observation effort.
708,luteal,17,28,care,Care,drop,Acupuncture for hormone balance,Regular fortnightly acupuncture significantly reduces PMS symptoms and improves luteal phase quality over 3 or more cycles.
709,menstrual,1,5,food,Nourish,leaf,Ashwagandha latte,Ashwagandha adaptogen in warm oat milk reduces cortisol and supports adrenal function stressed by the hormonal shift of menstruation.
710,menstrual,1,5,food,Nourish,leaf,Beet and carrot juice,This combination provides iron beta-carotene and folate in an easily absorbed liquid form gentle on a cramping stomach.
711,menstrual,1,5,food,Nourish,leaf,Avoid gluten if sensitive,For gluten-sensitive individuals menstruation is the time when gut reactions are strongest and elimination is most beneficial.
712,menstrual,1,5,food,Nourish,leaf,Pomegranate seeds on porridge,Pomegranate seeds add iron vitamin C and antioxidants to a warming breakfast that suits the menstrual phase perfectly.
713,menstrual,1,5,food,Nourish,leaf,White willow bark tea,Natural salicylate in white willow bark provides mild pain relief similar to aspirin without the stomach irritation.
714,menstrual,1,5,food,Nourish,leaf,Black strap molasses smoothie,Add one tablespoon to a banana smoothie. You will not taste it but you will get significant iron calcium and magnesium.
715,menstrual,1,5,food,Nourish,leaf,Avoid excess vitamin A,High-dose vitamin A supplements can worsen menstrual flow. Get vitamin A from food sources like sweet potato and eggs instead.
716,menstrual,1,5,food,Nourish,leaf,Mineral broth,A broth made from vegetable scraps seaweed and spices provides a concentrated mineral hit that replenishes what bleeding depletes.
717,menstrual,1,5,food,Nourish,leaf,Cardamom for nausea,Cardamom in warm water or tea reduces the nausea common on heavy flow days without the stimulant effect of ginger.
718,menstrual,1,5,food,Nourish,leaf,Eat before taking painkillers,Any NSAID taken for period pain must be taken with food. Stomach lining is more sensitive during menstruation.
719,menstrual,1,5,food,Nourish,leaf,Slow-cooked lentil stew,A simple slow-cooked lentil stew with iron-rich vegetables provides the mineral density your body needs without demanding digestion.
720,menstrual,1,5,food,Nourish,leaf,Avoid sushi and raw fish,Immune function is mildly reduced during menstruation. Avoiding raw fish reduces food safety risk during the vulnerable window.
721,menstrual,1,5,food,Nourish,leaf,Bone-in meat for marrow,Eating bone-in meats or meat close to the bone provides collagen marrow and minerals not found in boneless cuts.
722,menstrual,1,5,food,Nourish,leaf,Rose hip tea for vitamin C,Rose hip is one of the richest plant sources of vitamin C which increases iron absorption from plant-based meals.
723,menstrual,1,5,food,Nourish,leaf,Reduce soy lecithin products,Soy lecithin in processed foods can interfere with iron absorption when consumed alongside iron-rich foods during menstruation.
724,menstrual,1,5,move,Move,heart,TENS device use,A TENS machine placed on the lower abdomen provides electrical muscle stimulation that significantly reduces menstrual pain.
725,menstrual,1,5,move,Move,heart,Progressive muscle relaxation,Systematically tensing and releasing muscle groups from toes to head reduces the full-body tension of menstrual discomfort.
726,menstrual,1,5,move,Move,heart,Inversions avoided in yoga,Traditional yoga specifically avoids inversions during menstruation as they may increase blood flow. Stay upright or horizontal.
727,menstrual,1,5,move,Move,heart,Garden or light housework,Gentle purposeful movement like weeding or light tidying provides enough stimulation to lift mood without demanding energy.
728,menstrual,1,5,move,Move,heart,Shoulder stand alternative,Replace shoulder stand with supported legs up the wall which provides similar benefits without the inversion concern during menstruation.
