id,phase,cycle_day_min,cycle_day_max,kind,tag,icon,title,body
868,luteal,17,28,mood,Mind,moon,Future self letter,Write a letter to yourself from 6 months in the future describing how things have improved. Surprisingly effective for luteal perspective.
869,luteal,17,28,mood,Mind,moon,Boundary audit,What boundaries have you been neglecting. The luteal phase makes the cost of overstepped boundaries viscerally clear.
870,luteal,17,28,mood,Mind,moon,Reduce your goals this week,Take your goal list and cut it by 50 percent for this week. The remaining 50 percent is still ambitious for luteal capacity.
871,luteal,17,28,mood,Mind,moon,Organise one drawer,The small completable task of organising a single drawer provides the achievement satisfaction the luteal brain craves.
872,luteal,17,28,mood,Mind,moon,Plan next month now,Using the clarity of the early luteal phase plan your follicular and ovulation phases for next cycle while the contrast is visible.
873,luteal,17,28,mood,Mind,moon,Emotional regulation playlist,Create a specific playlist for the luteal phase that you know helps regulate your mood. Music is the fastest emotional intervention.
874,luteal,22,28,mood,Mind,moon,Hold decisions until follicular,Career life and relationship decisions that feel urgent in late luteal almost always look different in the follicular phase.
875,luteal,17,28,mood,Mind,moon,Name the cognitive distortion,PMS thinking tends toward catastrophising all-or-nothing and mind reading. Naming the distortion breaks its automatic power.
876,luteal,17,28,mood,Mind,moon,Prepare for next week,Spending 20 minutes on Sunday preparing for the week ahead reduces the cognitive load during the potentially heavier luteal week ahead.
877,luteal,17,28,mood,Mind,moon,Compassion meditation,A loving kindness or compassion meditation is particularly supportive in the luteal phase when the inner critic is loudest.
878,luteal,17,28,mood,Mind,moon,Acknowledge what you are carrying,Name the things you are holding right now. Acknowledging each one reduces the diffuse anxiety of carrying it all unconsciously.
879,luteal,17,28,mood,Mind,moon,Simplify your environment,A cluttered physical space amplifies mental clutter in the luteal phase. Spend 10 minutes clearing your immediate environment.
880,luteal,22,28,mood,Mind,moon,Anticipate the shift,Knowing that your period will begin soon and that energy will feel very different by day 2 or 3 makes the late luteal more bearable.
881,luteal,17,28,mood,Mind,moon,Lower your voice volume,Luteal irritability is often triggered by overstimulation. Consciously lowering your speaking volume creates immediate physiological calm.
882,luteal,17,28,mood,Mind,moon,Make a done list not a to-do list,Instead of what you need to do write everything you have already done today. The luteal brain underestimates its own output enormously.
883,luteal,17,28,care,Care,drop,Magnesium lotion before bed,Magnesium body lotion applied to skin absorbs transdermally and reduces the muscular tension anxiety and sleep disruption of the luteal phase.
884,luteal,17,28,care,Care,drop,Avoid over-the-counter sleep aids,Many sleep aids disrupt the architecture of sleep. Magnesium chamomile and sleep hygiene are safer for hormone-disrupted luteal sleep.
885,luteal,17,28,care,Care,drop,Iron-rich supplement consideration,If blood tests show low ferritin a chelated iron supplement taken during the luteal and menstrual phases prevents depletion.
886,luteal,17,28,care,Care,drop,Herbal bath blend,Lavender chamomile and rose petals in a bath reduce anxiety and promote sleep in the luteal phase through aromatherapy and warmth.
887,luteal,17,28,care,Care,drop,Skin barrier repair products,The luteal phase can compromise the skin barrier. Products with ceramides and fatty acids repair this before pre-period skin issues peak.
888,luteal,17,28,care,Care,drop,Weighted sleep mask,A weighted eye mask applies gentle pressure around the eyes activating the oculocardiac reflex that slows the heart rate and promotes sleep.
889,luteal,17,28,care,Care,drop,Loose comfortable sleepwear,Tight waistbands and synthetic fabrics make the fluid retention and temperature dysregulation of luteal sleep significantly worse.
890,luteal,17,28,care,Care,drop,Avoid eating in bed,The luteal phase disrupts the sleep-wake cycle. Keeping beds for sleep only maintains the circadian signal needed for luteal sleep quality.
891,luteal,17,28,care,Care,drop,Rescue Remedy for acute anxiety,Bach Rescue Remedy or similar flower essence preparations are a gentle first aid tool for acute luteal anxiety moments.
892,luteal,17,28,care,Care,drop,Consistent wake time,Maintaining the same wake time even on poor sleep nights anchors the circadian rhythm which is easily disrupted in the luteal phase.
893,luteal,17,28,care,Care,drop,Fan for night sweats,Some people experience night sweats in the late luteal phase due to progesterone effects on thermoregulation. A fan provides immediate relief.
894,luteal,17,28,care,Care,drop,Silk pillowcase,Silk retains less heat and causes less friction than cotton reducing the discomfort of the temperature sensitivity of luteal sleep.
895,luteal,17,28,care,Care,drop,Eye pillow for tension headaches,A weighted lavender eye pillow applied to closed eyes reduces the frontal tension headaches common in the late luteal phase.
896,luteal,22,28,care,Care,drop,Prepare your menstrual toolkit,Stock your period kit now: pain relief products heat pad herbal teas and comfortable clothing for when day 1 arrives.
897,luteal,17,28,care,Care,drop,Check vitamin D levels,Low vitamin D significantly worsens PMS and luteal phase mood symptoms. A blood test and supplement if low is impactful.
898,luteal,17,28,care,Care,drop,Reduce hot showers,Very hot showers in the luteal phase vasodilate blood vessels increasing fluid retention and skin flushing. Warm is sufficient.
899,menstrual,1,5,food,Nourish,leaf,Figs for iron and calcium,Dried figs are exceptionally rich in calcium and iron. Three or four figs as an afternoon snack provide both minerals.
900,menstrual,1,5,food,Nourish,leaf,Avoid high-sugar yogurt,Plain unsweetened yogurt supports gut health during menstruation. Flavoured yogurts add sugar that worsens cramping and mood.
901,menstrual,1,5,food,Nourish,leaf,Warm lemon ginger water hourly,Sipping warm lemon ginger water throughout the day reduces inflammation maintains hydration and calms digestive discomfort.
902,menstrual,1,5,food,Nourish,leaf,Avoid bread if bloated,Many people find wheat dramatically worsens menstrual bloating. A 3-day wheat reduction on days 1-3 can make a significant difference.
903,menstrual,1,5,food,Nourish,leaf,Iron from both meat and plants,Haem iron from meat and non-haem iron from plants absorbed together provide better overall replenishment than either alone.
904,menstrual,1,5,move,Move,heart,Rest your voice too,If you teach present or sing consider reducing vocal demands during menstruation when the laryngeal tissues also swell.
905,menstrual,1,5,move,Move,heart,Gentle rock climbing traverse,If you climb staying low on traversing routes keeps you moving and engaging the body without the exertion of vertical routes.
906,menstrual,1,5,move,Move,heart,Lymphatic bouncing,Very gentle rebounding on a trampoline for 5 minutes moves lymphatic fluid reduces swelling and requires minimal energy.
907,menstrual,1,5,move,Move,heart,Hip bath therapy,Sitting in a shallow hip-depth warm bath for 20 minutes provides localised heat therapy directly to the uterine area.
908,menstrual,1,5,move,Move,heart,5 minute morning movement only,If energy is very low commit to just 5 minutes. Gentle stretching or slow walking for exactly 5 minutes. That is enough.
909,menstrual,1,5,mood,Mind,moon,Set a phone-free bedroom rule,Starting a phone-free bedroom rule during menstruation creates better sleep and a more genuinely restful space.
910,menstrual,1,5,mood,Mind,moon,Write to a future loved one,Writing a letter to someone you love about what you hope for them redirects menstrual emotional depth outward and creates meaning.
911,menstrual,1,5,mood,Mind,moon,Permission to be imperfect,You do not have to do menstruation well. You do not have to be graceful or grateful or productive. You just have to get through it.
912,menstrual,1,5,mood,Mind,moon,Let the house be messy,The energy required to maintain a tidy home during menstruation is energy taken from recovery. The mess will wait.
913,menstrual,1,5,mood,Mind,moon,Find the small pleasure,Identify one small thing that brings pleasure today and do it without justification. One cup of perfect tea counts.
914,menstrual,1,5,care,Care,drop,Period care subscription,Setting up a subscription delivery for period products removes the stress of running out and ensures you always have what you prefer.
915,menstrual,1,5,care,Care,drop,Note unusual symptoms,Fever chills vomiting with pain or unusual discharge during menstruation are symptoms to document and discuss with a doctor.
916,menstrual,1,5,care,Care,drop,Avoid new piercings or tattoos,Blood clotting is affected during menstruation and immune function is reduced. Postpone any piercing or tattoo for the follicular phase.
917,menstrual,1,5,care,Care,drop,Comfortable work setup,If working from home during menstruation optimise your setup: supportive chair warmth close bathroom and no tight clothing.
918,menstrual,1,5,care,Care,drop,Permission to nap,A 20-minute nap at midday during menstruation is restorative and does not mean something is wrong. It means you are listening.
919,follicular,6,13,food,Nourish,leaf,Kefir for microbiome,Daily kefir in the follicular phase introduces diverse beneficial bacteria that support estrogen metabolism throughout the cycle.
920,follicular,6,13,food,Nourish,leaf,Golden turmeric paste,Making and storing turmeric paste to add to dishes throughout the week ensures consistent anti-inflammatory benefit.
921,follicular,6,13,food,Nourish,leaf,Blood orange season boost,When in season blood oranges provide anthocyanins vitamin C and folate that support follicular hormonal activity.
922,follicular,6,13,food,Nourish,leaf,Collagen peptides in coffee,Adding collagen peptides to morning coffee provides joint and connective tissue support for the increased training load of this phase.
923,follicular,6,13,food,Nourish,leaf,Seasonal eating emphasis,Eating what is locally in season in the follicular phase connects food choices to natural cycles and maximises phytonutrient variety.
924,follicular,6,13,move,Move,sparkle,Functional fitness class,Classes that train movement patterns rather than isolated muscles suit the follicular phase when whole-body coordination is rising.
925,follicular,6,13,move,Move,sparkle,Indoor rowing benchmark,The Concept 2 rowing benchmark tests suit the follicular phase when cardiovascular endurance and pulling power peak.
926,follicular,6,13,move,Move,sparkle,Standup paddleboard race,SUP racing combines balance endurance and strategy in a way that suits follicular physical and cognitive capacity well.
927,follicular,6,13,move,Move,sparkle,Advanced mobility routine,A more advanced mobility routine targeting end-range strength and joint health suits the follicular phase recovery capacity.
928,follicular,6,13,move,Move,sparkle,Run your best 5km time,A timed 5km attempt suits the follicular phase when pace endurance and running economy are at their monthly best.
929,follicular,6,13,mood,Mind,sparkle,Build your personal brand,Writing your bio updating your LinkedIn or creating content for your professional presence suits follicular confidence and clarity.
930,follicular,6,13,mood,Mind,sparkle,Gratitude practice for growth,Writing specifically about your growth - skills learned challenges overcome and capacities gained - deepens follicular self-confidence.
931,follicular,6,13,mood,Mind,sparkle,Volunteer or give back,The generosity and social energy of the follicular phase makes this a good time to offer skills or time to a cause you care about.
932,follicular,6,13,mood,Mind,sparkle,Map your network,Thinking about who you know who could support your goals and reaching out suits the social and strategic energy of this phase.
933,follicular,6,13,mood,Mind,sparkle,Commit to a reading goal,Setting a reading goal for the cycle and starting it in the follicular phase maximises the chance of completion.
934,follicular,6,13,care,Care,heart,Mole and skin check,High energy and the ability to attend to health details make the follicular phase ideal for a skin check or self-examination.
935,follicular,6,13,care,Care,heart,Infrared sauna for recovery,Infrared sauna use in the follicular phase supports recovery from intense training and improves cardiovascular health markers.
936,follicular,6,13,care,Care,heart,Review your period tracker data,Reading back your last 3 months of tracked data during the follicular phase gives perspective and helps identify patterns.
937,follicular,6,13,care,Care,heart,Update your emergency contacts,Practical tasks like updating health records and emergency contacts are best done when energy and focus are available.
938,follicular,6,13,care,Care,heart,Plan nutritional periodisation,Using follicular clarity plan how your nutrition will shift through the next 4 phases to support each one optimally.
939,ovulation,14,16,food,Nourish,leaf,Acai for peak antioxidants,Acai berries provide one of the highest ORAC antioxidant scores of any food protecting peak reproductive and physical function.
940,ovulation,14,16,food,Nourish,leaf,Nori rolls for iodine,Seaweed nori provides iodine that supports thyroid function which directly influences ovulation quality and regularity.
941,ovulation,14,16,food,Nourish,leaf,Avocado toast with eggs,This combination provides healthy fat choline and protein - exactly the nutrient profile that supports peak ovulation function.
942,ovulation,14,16,food,Nourish,leaf,Reduce coffee to one cup,At ovulation cortisol and adrenaline are already slightly elevated. A second or third coffee pushes the system beyond optimal.
943,ovulation,14,16,food,Nourish,leaf,Hydrate for discharge comfort,Increased discharge at ovulation is normal and healthy. Good hydration maintains comfort and healthy cervical mucus quality.
944,ovulation,14,16,move,Move,heart,Sprint test benchmark,Record your sprint times at ovulation each cycle. The consistent pattern confirms your peak and guides scheduling.
945,ovulation,14,16,move,Move,heart,Strength endurance circuit,A circuit combining strength and endurance demands suits the ovulation window when both systems are simultaneously at their best.
946,ovulation,14,16,move,Move,heart,Yoga advanced workshop,Attending a more advanced yoga workshop or intensive suits the confidence strength and focus peak of ovulation.
947,ovulation,14,16,move,Move,heart,Triathlon sprint distance,A sprint distance triathlon is perfectly matched to the cardiovascular strength and competitive energy of the ovulation peak.
948,ovulation,14,16,move,Move,heart,Jump training plyometrics,Plyometric training produces the fastest power adaptations at ovulation when the neuromuscular system is at peak receptivity.
949,ovulation,14,16,mood,Mind,sparkle,Vision statement writing,Write a compelling one-page vision statement for your life or work. Ovulation confidence and language fluency make it sing.
950,ovulation,14,16,mood,Mind,sparkle,Community contribution,Making a visible contribution to your community neighbourhood or organisation suits the ovulation urge toward social impact.
951,ovulation,14,16,mood,Mind,sparkle,Start the conversation you fear,The conversation you have been most avoiding is best initiated at ovulation when you can approach it with confidence not anxiety.
952,ovulation,14,16,mood,Mind,sparkle,Take the creative risk,Submit the application enter the competition share the work. Ovulation is the window when the fear-to-action ratio is most favourable.
953,ovulation,14,16,mood,Mind,sparkle,Trust your instincts,Gut instincts are more reliable at ovulation when the noise of anxiety and fatigue is lowest. Trust the clear signal.
954,ovulation,14,16,care,Care,heart,Foam roll IT band,The joint laxity at ovulation increases IT band tension in runners. A thorough IT band foam rolling session prevents knee issues.
955,ovulation,14,16,care,Care,heart,Post-performance nutrition,After peak performance at ovulation a well-constructed meal within 30 minutes maximises recovery before the luteal phase begins.
956,ovulation,14,16,care,Care,heart,Pelvic awareness check-in,Tune into pelvic sensation on the days around ovulation. Mild awareness of ovulation is normal. Sharp pain is not.
957,ovulation,14,16,care,Care,heart,Ankle stability exercises,Increased joint laxity at ovulation elevates ankle sprain risk in sport. Single-leg balance exercises are a worthwhile precaution.
958,ovulation,14,16,care,Care,heart,Mark your peak in your calendar,Add a repeating note in your calendar for the ovulation window so you can schedule important events to align with it every cycle.
959,luteal,17,28,food,Nourish,leaf,Anti-PMS supplement protocol,A daily stack of magnesium B6 evening primrose oil and omega-3 taken from day 17 through menstruation reduces PMS significantly.
960,luteal,17,28,food,Nourish,leaf,Eat more in the luteal phase,Your metabolic rate is 5-10 percent higher in the luteal phase. Eating slightly more than usual is physiologically appropriate.
961,luteal,17,28,food,Nourish,leaf,Paprika and red pepper for B6,Red bell pepper and paprika are surprisingly rich in vitamin B6 which supports progesterone and reduces luteal mood symptoms.
962,luteal,17,28,food,Nourish,leaf,Limit artificial sweeteners,Artificial sweeteners disrupt gut bacteria and worsen the digestive symptoms already present in the progesterone-dominated luteal phase.
963,luteal,17,28,food,Nourish,leaf,Oily fish twice this week,DHA from oily fish reduces the neuroinflammation that contributes to brain fog and mood instability in the luteal phase.
964,luteal,17,28,food,Nourish,leaf,Eat mindfully and slowly,Progesterone slows digestion significantly. Eating slowly and chewing thoroughly prevents the bloating that rapid eating causes.
965,luteal,17,28,food,Nourish,leaf,St Johns Wort consideration,For mild luteal mood symptoms St Johns Wort has evidence for effectiveness. Discuss with your doctor as it has interactions.
966,luteal,17,28,food,Nourish,leaf,Artichoke and lemon starter,Beginning a meal with bitter artichoke and lemon stimulates bile and digestive enzymes making the whole meal easier to process.
967,luteal,17,28,food,Nourish,leaf,Luteal phase recipe batch cook,Batch cooking on day 17 or 18 when energy is still reasonable ensures you have nourishing meals ready for the harder days later.
968,luteal,17,28,food,Nourish,leaf,Green tea over black tea,Green tea provides L-theanine that reduces anxiety and sufficient antioxidants without the cortisol-raising effect of coffee in the luteal phase.
969,luteal,17,28,move,Move,heart,Slow Pilates on reformer,The reformer provides spring resistance that gently challenges the body without demanding energy output. Perfect for the luteal phase.
970,luteal,17,28,move,Move,heart,Gentle horse riding hack,A slow walking hack on a calm horse provides gentle movement rhythm and the emotional regulation benefit of animal connection.
971,luteal,17,28,move,Move,heart,Canoe or kayak gently,Gentle paddling on calm water provides upper body movement breath regulation and nature exposure ideal for the luteal phase.
972,luteal,17,28,move,Move,heart,Restorative yin class,A full yin yoga class held in long passive poses is one of the most therapeutic movement choices for the late luteal phase.
973,luteal,17,28,move,Move,heart,Bedtime yoga sequence,A 10-15 minute bedtime sequence of supine poses helps the body transition from the day and prepares luteal sleep.
974,luteal,17,28,move,Move,heart,Morning walk before screens,A 10-minute outdoor walk before looking at any screen sets cortisol rhythm and significantly improves luteal mood for the whole day.
975,luteal,17,28,move,Move,heart,Gentle aerial hammock,Supported aerial hammock poses provide decompression and gentle inversion that feels relieving without the core demand of active aerial work.
976,luteal,17,28,move,Move,heart,Slow motion movements,Doing normal movement at deliberately half speed focuses attention on sensation reduces cortisol and is surprisingly restorative.
977,luteal,17,28,move,Move,heart,Avoid extreme temperatures,Very hot yoga and cold plunges both stress the system in the late luteal phase when homeostatic capacity is reduced.
978,luteal,17,28,move,Move,heart,Supported backbend,A gentle supported backbend over a bolster or rolled blanket opens the chest and reverses the forward collapse of fatigue and low mood.
979,luteal,17,28,mood,Mind,moon,Review your support network,Who can you call at midnight. Who always makes you feel better. Identify and appreciate your support network in the luteal phase.
980,luteal,17,28,mood,Mind,moon,Visualise the follicular return,Close your eyes and vividly imagine how you will feel in 10 days when energy returns. This future-pacing reduces present difficulty.
981,luteal,17,28,mood,Mind,moon,Set gentle daily anchors,Choose 1-3 small rituals that anchor each day: a specific tea a particular route or a consistent time. Anchors reduce luteal uncertainty.
982,luteal,17,28,mood,Mind,moon,Honour the inner critic kindly,The inner critic is loudest in the luteal phase. Rather than fighting it ask: what is it trying to protect me from right now.
983,luteal,17,28,mood,Mind,moon,Rest your ambition temporarily,Ambition requires energy. In the luteal phase directing energy to recovery rather than expansion is strategic not failure.
984,luteal,22,28,mood,Mind,moon,Write your menstrual intentions,Before your period begins write what you want to release and what you want to receive this next cycle.
985,luteal,17,28,mood,Mind,moon,Gentle humour as medicine,Comedy that makes you laugh genuinely is one of the fastest mood elevators. Find something that reliably makes you laugh today.
986,luteal,17,28,mood,Mind,moon,Embrace the quiet,The luteal phase naturally moves inward. Instead of fighting the quiet lean into it as a necessary counterpart to the expansive phases.
987,luteal,17,28,mood,Mind,moon,Ask for help explicitly,The luteal phase is when asking for help is most important and often hardest. Practise a simple clear request to someone you trust.
988,luteal,17,28,mood,Mind,moon,Celebrate small completions,Did you make a meal send an email show up to work. In the luteal phase these are real achievements. Acknowledge them.
989,luteal,17,28,care,Care,drop,Osteopathy for pelvic pain,Regular osteopathic treatment addressing pelvic alignment reduces both luteal and menstrual pain over successive cycles.
990,luteal,17,28,care,Care,drop,Warm castor oil hip soak,Applying warm castor oil to the hip and lower abdomen wrapped in flannel for 30 minutes reduces pelvic inflammation significantly.
991,luteal,17,28,care,Care,drop,Progesterone saliva test,A saliva progesterone test in the mid-luteal phase (day 21) confirms whether adequate progesterone is being produced.
992,luteal,17,28,care,Care,drop,Comfortable home environment,Lighting temperature and sensory comfort in your home environment disproportionately affect luteal wellbeing. Optimise your space.
993,luteal,17,28,care,Care,drop,Pelvic steam therapy,Vaginal steaming with appropriate herbs is a traditional practice used to support pelvic circulation and ease premenstrual symptoms.
994,luteal,17,28,care,Care,drop,Natural laxative if constipated,Prunes flaxseed and plenty of water are the safest options for the constipation common in the progesterone-dominant luteal phase.
995,luteal,17,28,care,Care,drop,Self breast massage,Gentle circular breast self-massage improves lymphatic drainage and reduces the tenderness that progesterone causes in breast tissue.
996,luteal,22,28,care,Care,drop,Prepare comfort food ingredients,Stock your kitchen in advance with the ingredients for your most comforting healthy meal so day 1 is easy and nourishing.
997,luteal,17,28,care,Care,drop,Evening primrose for skin,Evening primrose oil both topically and as a supplement reduces the dryness redness and sensitivity of luteal phase skin.
998,luteal,17,28,care,Care,drop,Gentle face massage at night,A slow gentle face massage with a nourishing oil reduces tension headaches and supports the skin repair that happens during luteal sleep.
999,menstrual,1,5,food,Nourish,leaf,Prune juice for iron,Prune juice provides iron vitamin C and natural sorbitol that addresses the constipation common at the start of menstruation.
1000,menstrual,1,5,food,Nourish,leaf,Amaranth porridge,Amaranth is a grain exceptionally high in iron calcium and protein. A warm amaranth porridge is ideal for menstrual phase mornings.
1001,menstrual,1,5,food,Nourish,leaf,Avoid coffee first thing,Caffeine on an empty stomach increases cortisol and worsens cramping. Wait until after breakfast for your first coffee.
1002,menstrual,1,5,food,Nourish,leaf,Cacao and cherry smoothie,Raw cacao provides magnesium and tart cherry provides melatonin and anti-inflammatory compounds. A powerful menstrual smoothie.
1003,menstrual,1,5,food,Nourish,leaf,Slow-release snacks only,During menstruation stick to slow-release snacks only. Nuts seeds apple with nut butter or oatcakes with hummus.
1004,menstrual,1,5,move,Move,heart,Moonlight walk,An evening walk under natural light provides gentle movement and reconnects you with the lunar cycle that reflects your own.
1005,menstrual,1,5,move,Move,heart,Gentle dance alone,Dancing alone in your kitchen or room with no performance agenda is one of the most joyful forms of menstrual movement.
