id,phase,cycle_day_min,cycle_day_max,kind,tag,icon,title,body
310,menstrual,1,5,mood,Mind,moon,Reduce decision fatigue,Too many small decisions drain the mental energy you need for coping this week. Simplify meals routines and choices.
311,menstrual,1,5,mood,Mind,moon,Avoid people who drain you,Your emotional bandwidth is reduced. Being around high-maintenance people right now is a real physiological cost.
312,menstrual,1,5,mood,Mind,moon,Write what you want to release,Write down everything you want to let go of this cycle then symbolically destroy the list. The ritual is surprisingly powerful.
313,menstrual,1,5,mood,Mind,moon,Body gratitude practice,Name one thing your body did for you today. Even on a painful day your heart beat your lungs breathed. That is worth noting.
314,menstrual,1,5,mood,Mind,moon,Cancel the non-essential,Review your week and cancel one thing you agreed to out of obligation rather than desire. You will feel immediate relief.
315,menstrual,1,5,mood,Mind,moon,Nature sounds for nervous system,Recordings of rain forest or ocean sounds reduce cortisol by measurable amounts. Use as background while resting.
316,menstrual,1,5,mood,Mind,moon,Cry without apology,Emotional tears contain stress hormones. Crying is literally the body releasing cortisol. Let it happen without shame.
317,menstrual,1,5,mood,Mind,moon,Phone a trusted person,Not to vent necessarily but just to hear a familiar voice. Social connection reduces pain perception through oxytocin release.
318,menstrual,1,5,mood,Mind,moon,Write tomorrow plan tonight,Before sleeping write 3 things you will do tomorrow. This closes open cognitive loops and significantly improves sleep quality.
319,menstrual,1,5,mood,Mind,moon,Avoid difficult conversations,Your emotional reactivity is higher this week. If possible postpone conversations that require careful emotional calibration.
320,menstrual,1,5,mood,Mind,moon,Guided visualisation for pain,There are specific guided visualisations for menstrual pain where you visualise the cramping as melting heat. Find one on YouTube.
321,menstrual,1,5,mood,Mind,moon,Acceptance over resistance,Fighting the fact that you are menstruating increases suffering. Accepting this as a normal phase reduces the psychological burden.
322,menstrual,1,5,mood,Mind,moon,Sensory self-soothing kit,Prepare a small kit with items that engage calming senses: a scented candle soft fabric herbal tea and a good playlist.
323,menstrual,1,5,mood,Mind,moon,Lower your productivity bar,Doing 30 percent of your normal output is appropriate during menstruation not a failure. Adjust your definition of a good day.
324,menstrual,1,5,mood,Mind,moon,Look at nature photography,Research shows viewing nature images reduces cortisol even when you cannot be outside. A few minutes is enough.
325,menstrual,1,5,mood,Mind,moon,Avoid alcohol for mood,Alcohol is a depressant that worsens already low progesterone and estrogen levels. The short relief always makes things worse later.
326,menstrual,1,5,mood,Mind,moon,Track your emotional patterns,Note your mood today. Over several cycles you will see patterns that help you predict and prepare rather than be surprised.
327,menstrual,1,5,mood,Mind,moon,Aromatherapy with lavender,Lavender essential oil reduces anxiety and pain perception. Diffuse or dilute and apply to your wrists and temples.
328,menstrual,1,5,mood,Mind,moon,Menstrual art journaling,Drawing painting or collaging without intention is a powerful release for the emotional intensity of menstruation.
329,menstrual,1,5,mood,Mind,moon,Podcasts over social media,Listening to an interesting podcast provides mental engagement without the social comparison and cortisol of scrolling.
330,menstrual,1,5,mood,Mind,moon,One small act of pleasure,Do one thing today purely because it brings you pleasure. Not because it is productive or beneficial. Just because you want to.
331,menstrual,1,5,mood,Mind,moon,NSDR or yoga nidra,Non-sleep deep rest protocols are 20-minute guided relaxations that restore dopamine and reduce pain as effectively as a short sleep.
332,menstrual,1,5,mood,Mind,moon,Batch easy decisions,Decide in advance what you will eat wear and do so you do not have to make those choices in real time while uncomfortable.
333,menstrual,1,5,mood,Mind,moon,Reframe the week,This is a week of internal work not external achievement. The menstrual phase is productive in a different way than the world rewards.
334,menstrual,1,5,mood,Mind,moon,Colouring for active calm,Adult colouring activates a flow state that reduces anxiety without requiring the focus of more demanding creative work.
335,menstrual,1,5,mood,Mind,moon,Acknowledge your sensitivity,The emotional heightening of menstruation is also what makes you more empathetic and perceptive. It is a double-edged gift.
336,menstrual,1,5,mood,Mind,moon,Bilateral stimulation tapping,Tapping alternately on each knee while thinking of something stressful activates the bilateral processing that reduces emotional intensity.
337,menstrual,1,5,mood,Mind,moon,Postpone major decisions,Your risk assessment is skewed right now. Not because you are irrational but because the brain genuinely sees more threat at this phase.
338,menstrual,1,5,mood,Mind,moon,Read poetry or short pieces,Poetry activates different brain regions than prose. Short beautiful language provides emotional resonance without requiring sustained attention.
339,menstrual,1,5,mood,Mind,moon,Spend time with animals,Being with animals reduces cortisol raises oxytocin and requires nothing from you. Even animal videos provide measurable benefit.
340,menstrual,1,5,mood,Mind,moon,10-minute sunlight break,Even in winter standing in natural daylight for 10 minutes regulates the circadian rhythm and improves serotonin production.
341,menstrual,1,5,mood,Mind,moon,Comfort food ritual,Make your most comforting healthy meal slowly and deliberately. The act of preparing it is itself a form of self-care.
342,menstrual,1,5,mood,Mind,moon,Release the comparison,On the days you feel worst other people seem to have infinite energy. They have their own struggle. This week is yours.
343,menstrual,1,5,mood,Mind,moon,Extend bedtime by 30 minutes,Going to bed 30 minutes earlier than usual during menstruation significantly reduces next-day fatigue and emotional reactivity.
344,menstrual,1,5,mood,Mind,moon,Warmth as emotional tool,Physical warmth signals safety to the nervous system. Hot drinks warm baths and heated blankets are not indulgences - they are therapeutic.
345,menstrual,1,5,mood,Mind,moon,Write what is going well,Despite the discomfort something is going well. Writing three things that are working right now interrupts the negativity bias.
346,menstrual,1,5,mood,Mind,moon,Forgive yourself in advance,You will probably be less patient less productive and more emotional this week. That is expected. Decide now not to hold it against yourself.
347,menstrual,1,5,mood,Mind,moon,Limit high-stakes commitments,Try not to schedule important meetings pitches or performances during your menstrual window if you have any choice.
348,menstrual,1,5,mood,Mind,moon,Revisit past creative work,Looking at things you have made written or achieved in the past gives perspective and counters the low self-worth of menstruation.
349,menstrual,1,5,mood,Mind,moon,Silent 5 minutes,Just 5 minutes of sitting in complete silence with eyes closed resets the nervous system and is the simplest form of meditation.
350,menstrual,1,5,mood,Mind,moon,Positive touch,A hug from someone you trust a self-massage or even pressing your own hand on your heart triggers oxytocin release that reduces pain.
351,menstrual,1,5,care,Care,drop,Track clot size,Clots smaller than a 50p coin are normal. Larger clots or very heavy flow that soaks protection hourly warrants a doctors visit.
352,menstrual,1,5,care,Care,drop,Menstrual cup benefits,A menstrual cup can be worn for 12 hours reducing anxiety around leaks and allowing you to sleep through the night uninterrupted.
353,menstrual,1,5,care,Care,drop,Period underwear backup,Wearing period underwear as backup to your usual protection gives confidence for sleeping exercising and long journeys.
354,menstrual,1,5,care,Care,drop,Heating pad safety,Never fall asleep with a heating pad plugged in. Use a microwaveable wheat bag instead which cools safely.
355,menstrual,1,5,care,Care,drop,Castor oil compress,Applying warm castor oil to the lower abdomen with a cloth and heat for 30 minutes reduces pelvic inflammation significantly.
356,menstrual,1,5,care,Care,drop,Skin may be oilier,Progesterone drop causes a brief testosterone dominance that can increase skin oiliness. Switch to a lighter cleanser this week.
357,menstrual,1,5,care,Care,drop,Gentle cleansing only,Your vulval skin is more sensitive during menstruation. Use only warm water and avoid scented products entirely.
358,menstrual,1,5,care,Care,drop,Change clothes after exercise,Even gentle movement during menstruation increases moisture. Changing promptly reduces irritation and infection risk.
359,menstrual,1,5,care,Care,drop,Log your flow day by day,Recording whether flow is heavy medium or light each day over several cycles reveals your personal pattern.
360,menstrual,1,5,care,Care,drop,Organic cotton products,Conventional pads and tampons may contain traces of pesticides and bleach. Organic options are gentler on sensitive menstrual tissue.
361,menstrual,1,5,care,Care,drop,Avoid tight waistbands,Elastic pressing on a bloated abdomen is surprisingly painful. Opt for high-waisted soft-band leggings or loose trousers.
362,menstrual,1,5,care,Care,drop,B complex supplement,A B complex vitamin taken with food supports energy production mood stability and red blood cell formation during menstruation.
363,menstrual,1,5,care,Care,drop,Magnesium topical spray,Magnesium oil sprayed onto the lower abdomen and absorbed transdermally reduces cramps within 20-30 minutes.
364,menstrual,1,5,care,Care,drop,Sleep on a dark towel,If anxiety about leaking disrupts sleep place a dark towel under you and use your most reliable period product. Sleep matters more.
365,menstrual,1,5,care,Care,drop,Check iron supplement timing,Iron supplements are best absorbed on an empty stomach but this worsens nausea. Take with a small amount of food and vitamin C.
366,menstrual,1,5,care,Care,drop,Foot warmth reduces cramps,Wearing thick socks or using a foot warmer draws circulation downward and can reduce the intensity of uterine cramping.
367,menstrual,1,5,care,Care,drop,CBD oil for period pain,Topical CBD applied to the lower abdomen reduces menstrual pain for many people. Available legally in most countries.
368,menstrual,1,5,care,Care,drop,Evening primrose oil,500-1000mg of evening primrose oil taken in the second half of your cycle can significantly reduce PMS and period pain next month.
369,menstrual,1,5,care,Care,drop,Pelvic floor release,Consciously relaxing rather than engaging the pelvic floor during cramping reduces pain. Kegels should be avoided during menstruation.
370,menstrual,1,5,care,Care,drop,Cold flannel for lower back heat,Alternating heat and cold on the lower back - 3 minutes each - is more effective than heat alone for certain types of period back pain.
371,menstrual,1,5,care,Care,drop,Monitor sleep quality,Period-related sleep disruption is real and affects the next day significantly. Track sleep this week and identify what helps.
372,menstrual,1,5,care,Care,drop,Skin barrier extra care,Hormonal shifts can compromise the skin barrier. A simple fragrance-free moisturiser applied morning and night prevents dryness and reactivity.
373,menstrual,1,5,care,Care,drop,Reduce shower temperature,Very hot showers dilate blood vessels and can increase flow and dizziness on heavy days. Warm rather than hot is better.
374,menstrual,1,5,care,Care,drop,Acupuncture for period pain,Regular acupuncture has strong clinical evidence for reducing menstrual pain over several cycles. Worth trying if cramps are severe.
375,menstrual,1,5,care,Care,drop,Vitamin E for cramping,400 IU of vitamin E taken 2 days before and 3 days into your period has been shown to significantly reduce dysmenorrhea.
376,menstrual,1,5,care,Care,drop,Light scent environment,Heavy perfumes and synthetic fragrances can worsen nausea during menstruation. Opt for light natural scents or none at all.
377,menstrual,1,5,care,Care,drop,Omega-3 supplement if not from food,If you do not eat oily fish 2-3 times per week take 1-2g of EPA and DHA daily to reduce prostaglandin-driven cramping.
378,menstrual,1,5,care,Care,drop,Note pain patterns,Is the pain worse in the morning or evening. Does heat help or movement. Recording this guides better self-care over time.
379,menstrual,1,5,care,Care,drop,Avoid pool swimming on heavy days,Pools are fine with a tampon or cup but chlorine can irritate sensitive menstrual tissue. Rinse well afterwards.
380,menstrual,1,5,care,Care,drop,Check your tampon fit,A correctly placed tampon should not be felt at all. If you feel it it is not inserted far enough and needs repositioning.
381,menstrual,1,5,care,Care,drop,Iron-rich snack pack,Prepare a small bag with dried apricots pumpkin seeds and dark chocolate so you always have iron-rich snacks accessible.
382,menstrual,1,5,care,Care,drop,Self-compassion reminder card,Write yourself a small card that says something kind about this week. Put it where you will see it each morning.
383,menstrual,1,5,care,Care,drop,Avoid new medical procedures,Menstruation is not a good time for elective medical or dental procedures due to reduced clotting and increased sensitivity.
384,menstrual,1,5,care,Care,drop,Lubrication if needed,Estrogen drop can reduce natural lubrication. A water-based lubricant prevents irritation if intimacy is desired during menstruation.
385,menstrual,1,5,care,Care,drop,Cool the room at night,A slightly cooler bedroom reduces night sweats and the discomfort of sleeping with a hot water bottle.
386,menstrual,1,5,care,Care,drop,Document your cycle for your doctor,If period pain is severe enough to affect your daily function that is medically significant and worth documenting for your GP.
387,follicular,6,13,food,Nourish,leaf,Sesame seeds for estrogen,Sesame seeds contain lignans that support healthy estrogen levels as they rise in the follicular phase. Add to everything.
388,follicular,6,13,food,Nourish,leaf,Green smoothie daily,A daily green smoothie with spinach kale banana and flaxseed provides folate B6 and phytoestrogens that support follicle development.
389,follicular,6,13,food,Nourish,leaf,Artichokes for liver health,Artichokes contain cynarin which stimulates bile production and supports the liver in clearing old hormones as new estrogen rises.
390,follicular,6,13,food,Nourish,leaf,Wild salmon twice this week,Wild salmon provides astaxanthin and omega-3 that protect developing follicles from oxidative damage.
391,follicular,6,13,food,Nourish,leaf,Pea protein post-workout,Plant-based pea protein powder provides all essential amino acids and is easier on digestion than whey during the follicular training surge.
392,follicular,6,13,food,Nourish,leaf,Fermented vegetables daily,Kimchi sauerkraut and tempeh seed the gut with beneficial bacteria that influence estrogen metabolism and mood via the gut-brain axis.
393,follicular,6,13,food,Nourish,leaf,Fresh herbs in cooking,Parsley dill and fresh coriander contain apigenin and flavonoids that support estrogen activity. Use generously this week.
394,follicular,6,13,food,Nourish,leaf,Pomegranate for follicle health,Pomegranate seeds and juice are rich in antioxidants that protect the developing follicle and support estrogen receptor activity.
395,follicular,6,13,food,Nourish,leaf,Avoid skipping breakfast,Your metabolism is accelerating in the follicular phase. Skipping breakfast leads to blood sugar crashes that disrupt the clean energy of this week.
396,follicular,6,13,food,Nourish,leaf,Oily fish for brain clarity,DHA in oily fish directly supports the cognitive sharpness and improved memory characteristic of the follicular phase.
397,follicular,6,13,food,Nourish,leaf,Asparagus for folate,Asparagus is one of the richest food sources of folate which supports cell division and DNA repair as follicles mature.
398,follicular,6,13,food,Nourish,leaf,Limit refined carbs now,Your insulin sensitivity is good in the follicular phase but large portions of white bread and pasta still blunt the clean energy of this week.
399,follicular,6,13,food,Nourish,leaf,Cacao nibs for magnesium,Raw cacao nibs provide magnesium and flavonoids without the sugar of chocolate. Add to trail mix or porridge.
400,follicular,6,13,food,Nourish,leaf,Liver once per week,Chicken liver is the most nutrient-dense food available providing iron B12 vitamin A and CoQ10 in one small serving.
401,follicular,6,13,food,Nourish,leaf,Hydrate before coffee,Drinking 500ml of water before your first coffee prevents the dehydrating effect of caffeine from blunting your follicular energy.
402,follicular,6,13,food,Nourish,leaf,Celery for natural sodium,Celery provides natural sodium potassium and apigenin. Better electrolyte balance than adding table salt to food.
403,follicular,6,13,food,Nourish,leaf,Matcha over coffee,Matcha provides sustained alertness via L-theanine without the cortisol spike of coffee. Better for hormonal balance this week.
404,follicular,6,13,food,Nourish,leaf,Quinoa for complete protein,Quinoa is the only grain that contains all essential amino acids. It supports muscle recovery as training intensity increases this week.
405,follicular,6,13,food,Nourish,leaf,Berries for antioxidants,Blueberries raspberries and strawberries protect growing follicles from oxidative stress. Eat a handful daily.
406,follicular,6,13,food,Nourish,leaf,Avocado daily,Avocado provides monounsaturated fat that is the direct building block of steroid hormones including estrogen.
407,follicular,6,13,food,Nourish,leaf,Dandelion greens in salad,Dandelion greens are bitter herbs that stimulate bile flow and support liver detoxification of estrogen metabolites.
408,follicular,6,13,food,Nourish,leaf,Sunflower seeds for vitamin E,Vitamin E in sunflower seeds supports follicle integrity and protects the developing egg from oxidative damage.
409,follicular,6,13,food,Nourish,leaf,Pre-workout protein snack,Eating 20g of protein 60 minutes before training increases muscle protein synthesis during the follicular performance window.
410,follicular,6,13,food,Nourish,leaf,Reduce alcohol this week,Alcohol disrupts estrogen metabolism in the liver and impairs the clean hormone rise needed for healthy follicle development.
411,follicular,6,13,food,Nourish,leaf,Colourful root vegetables,Carrots sweet potato and beetroot provide beta-carotene and phytoestrogens that support hormonal balance as estrogen rises.
412,follicular,6,13,food,Nourish,leaf,Post-workout refuel window,Eating carbohydrates and protein within 30 minutes of training is most effective in the follicular phase when muscle uptake is highest.
413,follicular,6,13,food,Nourish,leaf,Mineral water over still,Mineral water provides magnesium calcium and silica not found in tap water. Switch for at least half your daily intake.
414,follicular,6,13,food,Nourish,leaf,Lemon and olive oil dressing,A simple dressing of lemon juice and extra virgin olive oil provides vitamin C flavonoids and oleocanthal with every salad.
415,follicular,6,13,food,Nourish,leaf,Increase calories with activity,As training intensity increases caloric needs rise. Under-eating during follicular training blunts performance and recovery.
416,follicular,6,13,food,Nourish,leaf,Natto for vitamin K2,Natto is the richest food source of vitamin K2 which directs calcium into bones and away from arteries. Worth trying.
417,follicular,6,13,food,Nourish,leaf,Edamame for complete protein,Edamame provides complete plant protein plus isoflavones that gently modulate estrogen activity. A great snack this week.
418,follicular,6,13,food,Nourish,leaf,Reduce sugar before ovulation,Excess sugar disrupts the insulin signalling needed for optimal LH surge and follicle release. Wind it down as day 14 approaches.
419,follicular,6,13,food,Nourish,leaf,Chlorophyll-rich foods,Chlorella spirulina and wheatgrass are rich in chlorophyll which supports detoxification and oxygenation as energy rises.
420,follicular,6,13,food,Nourish,leaf,Honey for quick energy,Raw honey provides glucose and fructose for rapid pre-workout energy plus prebiotics that support gut health.
421,follicular,6,13,food,Nourish,leaf,Evening meal timing matters,Eating dinner before 7pm allows the liver 12 hours to process the day hormones before the next rise begins in the morning.
422,follicular,6,13,move,Move,sparkle,Sprint interval training,8 x 30-second sprints with 90-second recovery is one of the most effective formats for the follicular performance window.
423,follicular,6,13,move,Move,sparkle,Olympic lifting technique,Power cleans snatches and jerks suit the improved neuromuscular coordination of the follicular phase. Focus on technique.
424,follicular,6,13,move,Move,sparkle,Parkour or movement exploration,Playful exploratory movement suits the rising creativity and physical confidence of the follicular phase perfectly.
425,follicular,6,13,move,Move,sparkle,Aerial yoga,The strength required for aerial inversions and poses suits the follicular peak. Try an aerial class this week.
426,follicular,6,13,move,Move,sparkle,Long weekend hike,Plan a challenging hike for this weekend. Rising estrogen supports endurance and your pain tolerance is also improving.
427,follicular,6,13,move,Move,sparkle,Surf or paddleboard,Balance and core stability improve in the follicular phase. Water-based balance sports feel particularly satisfying this week.
428,follicular,6,13,move,Move,sparkle,Bootcamp or circuit class,The variety of circuit training suits the follicular desire for novelty and challenge. Push hard and enjoy the recovery.
429,follicular,6,13,move,Move,sparkle,Heavy deadlifts,Your back strength and posterior chain power peak in the follicular phase. A heavy deadlift session will feel remarkably good.
430,follicular,6,13,move,Move,sparkle,Gymnastics skills,Handstands cartwheels and balance skills are best learned in the follicular phase when coordination and body awareness peak.
431,follicular,6,13,move,Move,sparkle,Competitive running race,If you race register for an event in the follicular window. Race-day performance is measurably better in this phase.
432,follicular,6,13,move,Move,sparkle,Kettlebell swings,The hip-hinge power of kettlebell swings suits follicular strength levels. Start with a challenging weight and build across the week.
433,follicular,6,13,move,Move,sparkle,Indoor climbing competition,Follicular coordination confidence and pain tolerance suit competitive indoor climbing particularly well.
434,follicular,6,13,move,Move,sparkle,Triathlon training block,All three disciplines of triathlon suit the follicular phase. Plan your highest-volume training block here.
435,follicular,6,13,move,Move,sparkle,Crossfit WOD,The intensity and variety of Crossfit workouts align perfectly with follicular energy and recovery capacity.
436,follicular,6,13,move,Move,sparkle,Ballet barre strength,Classical ballet barre training builds exceptional leg strength and balance. The precision suits follicular mental sharpness.
437,follicular,6,13,move,Move,sparkle,Long slow distance run,Build your aerobic base with a long slow run. Estrogen supports fat oxidation which makes long distances feel more sustainable.
438,follicular,6,13,move,Move,sparkle,Heavy squat session,Barbell back squats and front squats are excellent choices for the follicular phase. Set a personal best this week.
439,follicular,6,13,move,Move,sparkle,Soccer or basketball,Team sports with running and agility suit the follicular coordination and social energy peaks simultaneously.
440,follicular,6,13,move,Move,sparkle,Cycling climbing challenge,Taking on a hill or mountain cycling route suits your follicular endurance and mental toughness window.
441,follicular,6,13,move,Move,sparkle,Morning run before work,Follicular morning energy is notably higher. A 30-minute run before work sets cognitive and physical tone for the whole day.
442,follicular,6,13,move,Move,sparkle,Handstand practice,Inverting and building shoulder stability suits both the strength gains and vestibular confidence of the follicular phase.
443,follicular,6,13,move,Move,sparkle,Tennis or racket sports,The explosive lateral movement and hand-eye coordination of racket sports suit follicular neuromuscular peaks.
444,follicular,6,13,move,Move,sparkle,Rowing machine intervals,Rowing engages 86 percent of muscles and suits follicular whole-body strength and cardiovascular capacity.
445,follicular,6,13,move,Move,sparkle,Muscle up progression,Gymnastic pulling movements suit follicular upper body strength. Work toward a muscle up or progress the movement pattern.
446,follicular,6,13,move,Move,sparkle,Hip thrust progression,Glute-focused hip thrusts build posterior chain power most efficiently when hormones are rising in the follicular phase.
447,follicular,6,13,move,Move,sparkle,Assault bike sprints,The total body demand of the assault bike suits follicular capacity. Short maximal efforts feel powerful and achievable.
448,follicular,6,13,move,Move,sparkle,Jiu-jitsu or wrestling,Grappling sports that require strength problem-solving and physical confidence suit the follicular phase very well.
449,follicular,6,13,move,Move,sparkle,Nordic walking with poles,Adding poles to walking dramatically increases upper body engagement and caloric expenditure for a full-body follicular workout.
450,follicular,6,13,move,Move,sparkle,Resistance band superset,Supersets with resistance bands keep heart rate elevated and maximise time efficiency for busy follicular schedules.
